{
  "flow_graph_schema_version": "1.0.0",
  "flow_graph_id": "sha256:cf5ddad862428cc2d7dd5504bec97e609d03702a8b4d0faa4b151b87123f2911",
  "topology": {
    "topology_schema_version": "1.0.0",
    "topology_id": "sha256:35db54533104623993c3a7ac6e884232c2169de1239cf3bd60def91758754ce1",
    "baseline_id": "PROGRAM-BASELINE",
    "baseline_revision": 2,
    "nodes": [
      {
        "node_id": "G-MERGE",
        "name": "Program integration gate",
        "node_type": "gate",
        "lane": {"lane_type": "program", "lane_id": "PROGRAM"},
        "predecessor_rule": "all",
        "baseline_revision": 2,
        "source": {"artifact_id": "BASELINE-R2", "artifact_path": "plans/program-baseline.md", "field": "gates.G-MERGE", "source_fingerprint": "sha256:aaaaaaaaaaaaaaaaaaaaaaaaaaaaaaaaaaaaaaaaaaaaaaaaaaaaaaaaaaaaaaaa"}
      },
      {
        "node_id": "M-A",
        "name": "Lane one complete",
        "node_type": "milestone",
        "lane": {"lane_type": "workstream", "lane_id": "L1"},
        "baseline_revision": 2,
        "source": {"artifact_id": "BASELINE-R2", "artifact_path": "plans/program-baseline.md", "field": "milestones.M-A", "source_fingerprint": "sha256:aaaaaaaaaaaaaaaaaaaaaaaaaaaaaaaaaaaaaaaaaaaaaaaaaaaaaaaaaaaaaaaa"}
      },
      {
        "node_id": "M-B",
        "name": "Lane two complete",
        "node_type": "milestone",
        "lane": {"lane_type": "workstream", "lane_id": "L2"},
        "baseline_revision": 2,
        "source": {"artifact_id": "BASELINE-R2", "artifact_path": "plans/program-baseline.md", "field": "milestones.M-B", "source_fingerprint": "sha256:aaaaaaaaaaaaaaaaaaaaaaaaaaaaaaaaaaaaaaaaaaaaaaaaaaaaaaaaaaaaaaaa"}
      },
      {
        "node_id": "M-C",
        "name": "Conditional rollout",
        "node_type": "milestone",
        "lane": {"lane_type": "workstream", "lane_id": "L1"},
        "baseline_revision": 2,
        "source": {"artifact_id": "BASELINE-R2", "artifact_path": "plans/program-baseline.md", "field": "milestones.M-C", "source_fingerprint": "sha256:aaaaaaaaaaaaaaaaaaaaaaaaaaaaaaaaaaaaaaaaaaaaaaaaaaaaaaaaaaaaaaaa"}
      },
      {
        "node_id": "M-D",
        "name": "Rework verification",
        "node_type": "milestone",
        "lane": {"lane_type": "workstream", "lane_id": "L2"},
        "baseline_revision": 2,
        "source": {"artifact_id": "BASELINE-R2", "artifact_path": "plans/program-baseline.md", "field": "milestones.M-D", "source_fingerprint": "sha256:aaaaaaaaaaaaaaaaaaaaaaaaaaaaaaaaaaaaaaaaaaaaaaaaaaaaaaaaaaaaaaaa"}
      }
    ],
    "edges": [
      {
        "edge_id": "E-A-MERGE",
        "predecessor": "M-A",
        "target": "G-MERGE",
        "relationship_type": "aggregation",
        "label": "lane one input",
        "baseline_revision": 2,
        "source": {"artifact_id": "BASELINE-R2", "artifact_path": "plans/program-baseline.md", "field": "gates.G-MERGE.dependencies.E-A-MERGE", "source_fingerprint": "sha256:aaaaaaaaaaaaaaaaaaaaaaaaaaaaaaaaaaaaaaaaaaaaaaaaaaaaaaaaaaaaaaaa"}
      },
      {
        "edge_id": "E-B-MERGE",
        "predecessor": "M-B",
        "target": "G-MERGE",
        "relationship_type": "aggregation",
        "label": "lane two input",
        "baseline_revision": 2,
        "source": {"artifact_id": "BASELINE-R2", "artifact_path": "plans/program-baseline.md", "field": "gates.G-MERGE.dependencies.E-B-MERGE", "source_fingerprint": "sha256:aaaaaaaaaaaaaaaaaaaaaaaaaaaaaaaaaaaaaaaaaaaaaaaaaaaaaaaaaaaaaaaa"}
      },
      {
        "edge_id": "E-CONDITION",
        "predecessor": "G-MERGE",
        "target": "M-C",
        "relationship_type": "conditional",
        "condition": {
          "fact_id": "DECISION-1",
          "operator": "equals",
          "expected_value": "approved",
          "source": {"artifact_id": "DECISION-1", "artifact_path": "decisions/decision-log.md", "field": "DECISION-1.status", "source_fingerprint": "sha256:bbbbbbbbbbbbbbbbbbbbbbbbbbbbbbbbbbbbbbbbbbbbbbbbbbbbbbbbbbbbbbbb"}
        },
        "label": "when approved",
        "baseline_revision": 2,
        "source": {"artifact_id": "BASELINE-R2", "artifact_path": "plans/program-baseline.md", "field": "milestones.M-C.dependencies.E-CONDITION", "source_fingerprint": "sha256:aaaaaaaaaaaaaaaaaaaaaaaaaaaaaaaaaaaaaaaaaaaaaaaaaaaaaaaaaaaaaaaa"}
      },
      {
        "edge_id": "E-INFO",
        "predecessor": "M-A",
        "target": "M-B",
        "relationship_type": "informational",
        "label": "cross-lane context",
        "baseline_revision": 2,
        "source": {"artifact_id": "BASELINE-R2", "artifact_path": "plans/program-baseline.md", "field": "milestones.M-B.dependencies.E-INFO", "source_fingerprint": "sha256:aaaaaaaaaaaaaaaaaaaaaaaaaaaaaaaaaaaaaaaaaaaaaaaaaaaaaaaaaaaaaaaa"}
      },
      {
        "edge_id": "E-REWORK",
        "predecessor": "M-C",
        "target": "M-D",
        "relationship_type": "rework",
        "label": "return for verification",
        "baseline_revision": 2,
        "source": {"artifact_id": "BASELINE-R2", "artifact_path": "plans/program-baseline.md", "field": "milestones.M-D.dependencies.E-REWORK", "source_fingerprint": "sha256:aaaaaaaaaaaaaaaaaaaaaaaaaaaaaaaaaaaaaaaaaaaaaaaaaaaaaaaaaaaaaaaa"}
      }
    ],
    "lineage": [
      {"artifact_id": "BASELINE-R2", "artifact_path": "plans/program-baseline.md", "field": "revision.2", "source_fingerprint": "sha256:aaaaaaaaaaaaaaaaaaaaaaaaaaaaaaaaaaaaaaaaaaaaaaaaaaaaaaaaaaaaaaaa"}
    ]
  },
  "state": {
    "state_schema_version": "1.0.0",
    "state_snapshot_id": "sha256:579d51322f5e3205b7cd8d74fa81ed21586d868d57e80b4d1176de01fc34f915",
    "topology_id": "sha256:35db54533104623993c3a7ac6e884232c2169de1239cf3bd60def91758754ce1",
    "as_of": "2026-07-13T12:00:00Z",
    "nodes": [
      {
        "node_id": "G-MERGE",
        "execution": {"value": "ready", "rule_id": "EXEC-READY", "sources": [{"artifact_id": "STATUS-1", "artifact_path": "views/program-status.json", "field": "flow_state.G-MERGE.execution", "source_fingerprint": "sha256:cccccccccccccccccccccccccccccccccccccccccccccccccccccccccccccccc"}]},
        "health": {"value": "blocked", "rule_id": "HEALTH-BLOCKED", "sources": [{"artifact_id": "STATUS-1", "artifact_path": "views/program-status.json", "field": "flow_state.G-MERGE.health", "source_fingerprint": "sha256:cccccccccccccccccccccccccccccccccccccccccccccccccccccccccccccccc"}]}
      },
      {
        "node_id": "M-A",
        "execution": {"value": "in-progress", "rule_id": "EXEC-STARTED", "sources": [{"artifact_id": "STATUS-1", "artifact_path": "views/program-status.json", "field": "flow_state.M-A.execution", "source_fingerprint": "sha256:cccccccccccccccccccccccccccccccccccccccccccccccccccccccccccccccc"}]},
        "health": {"value": "at-risk", "rule_id": "HEALTH-RISK", "sources": [{"artifact_id": "STATUS-1", "artifact_path": "views/program-status.json", "field": "flow_state.M-A.health", "source_fingerprint": "sha256:cccccccccccccccccccccccccccccccccccccccccccccccccccccccccccccccc"}]}
      },
      {
        "node_id": "M-B",
        "execution": {"value": "complete", "rule_id": "EXEC-COMPLETE", "sources": [{"artifact_id": "STATUS-1", "artifact_path": "views/program-status.json", "field": "flow_state.M-B.execution", "source_fingerprint": "sha256:cccccccccccccccccccccccccccccccccccccccccccccccccccccccccccccccc"}]},
        "health": {"value": "on-plan", "rule_id": "HEALTH-PLAN", "sources": [{"artifact_id": "STATUS-1", "artifact_path": "views/program-status.json", "field": "flow_state.M-B.health", "source_fingerprint": "sha256:cccccccccccccccccccccccccccccccccccccccccccccccccccccccccccccccc"}]}
      },
      {
        "node_id": "M-C",
        "execution": {"value": "planned", "rule_id": "EXEC-PLANNED", "sources": [{"artifact_id": "STATUS-1", "artifact_path": "views/program-status.json", "field": "flow_state.M-C.execution", "source_fingerprint": "sha256:cccccccccccccccccccccccccccccccccccccccccccccccccccccccccccccccc"}]},
        "health": {"value": "indeterminate", "rule_id": "HEALTH-INDETERMINATE", "sources": [{"artifact_id": "STATUS-1", "artifact_path": "views/program-status.json", "field": "flow_state.M-C.health", "source_fingerprint": "sha256:cccccccccccccccccccccccccccccccccccccccccccccccccccccccccccccccc"}]}
      },
      {
        "node_id": "M-D",
        "execution": {"value": "planned", "rule_id": "EXEC-PLANNED", "sources": [{"artifact_id": "STATUS-1", "artifact_path": "views/program-status.json", "field": "flow_state.M-D.execution", "source_fingerprint": "sha256:cccccccccccccccccccccccccccccccccccccccccccccccccccccccccccccccc"}]},
        "health": {"value": "on-plan", "rule_id": "HEALTH-PLAN", "sources": [{"artifact_id": "STATUS-1", "artifact_path": "views/program-status.json", "field": "flow_state.M-D.health", "source_fingerprint": "sha256:cccccccccccccccccccccccccccccccccccccccccccccccccccccccccccccccc"}]}
      }
    ],
    "relationships": [
      {"edge_id": "E-A-MERGE", "state": {"value": "active", "rule_id": "REL-ACTIVE", "sources": [{"artifact_id": "STATUS-1", "artifact_path": "views/program-status.json", "field": "relations.E-A-MERGE.state", "source_fingerprint": "sha256:cccccccccccccccccccccccccccccccccccccccccccccccccccccccccccccccc"}]}, "health": {"value": "at-risk", "rule_id": "REL-RISK", "sources": [{"artifact_id": "STATUS-1", "artifact_path": "views/program-status.json", "field": "relations.E-A-MERGE.health", "source_fingerprint": "sha256:cccccccccccccccccccccccccccccccccccccccccccccccccccccccccccccccc"}]}},